{
 "schema_version": "1.0",
 "scene_id": "chem-balance-ci-01-s04",
 "fps": 30,
 "duration": 12.1,
 "language": "en-IN",
 "alignment_source": "tts_provider",
 "narration_audio_sha256": "c7cfe0ed91884df8b522fb9ebb8cd97ff92242f68684404117e64f2c4bfb3d9e",
 "script_sha256": "67853079faf35e0a686e7a6c0661db3942d6aaa9b4e470f9e082d74f2b4f2713",
 "words": [
  {
   "w": "A",
   "t0": 0.157,
   "t1": 0.18
  },
  {
   "w": "tempting",
   "t0": 0.26,
   "t1": 0.74
  },
  {
   "w": "fix",
   "t0": 0.9,
   "t1": 1.3
  },
  {
   "w": "is",
   "t0": 1.38,
   "t1": 1.46,
   "occurrence": 1
  },
  {
   "w": "to",
   "t0": 1.54,
   "t1": 1.62
  },
  {
   "w": "change",
   "t0": 1.74,
   "t1": 1.86,
   "occurrence": 1
  },
  {
   "w": "a",
   "t0": 1.94,
   "t1": 2.1,
   "occurrence": 1
  },
  {
   "w": "subscript",
   "t0": 2.22,
   "t1": 3.06
  },
  {
   "w": "so",
   "t0": 3.14,
   "t1": 3.38
  },
  {
   "w": "water",
   "t0": 3.62,
   "t1": 4.02
  },
  {
   "w": "becomes",
   "t0": 4.1,
   "t1": 4.5
  },
  {
   "w": "hydrogen",
   "t0": 4.66,
   "t1": 5.14
  },
  {
   "w": "peroxide",
   "t0": 5.22,
   "t1": 6.26
  },
  {
   "w": "The",
   "t0": 6.34,
   "t1": 6.42
  },
  {
   "w": "counts",
   "t0": 6.58,
   "t1": 6.74
  },
  {
   "w": "can",
   "t0": 6.82,
   "t1": 6.9
  },
  {
   "w": "match",
   "t0": 6.98,
   "t1": 7.54
  },
  {
   "w": "but",
   "t0": 7.62,
   "t1": 7.7
  },
  {
   "w": "that",
   "t0": 7.78,
   "t1": 7.86
  },
  {
   "w": "is",
   "t0": 7.94,
   "t1": 8.02,
   "occurrence": 2
  },
  {
   "w": "a",
   "t0": 8.1,
   "t1": 8.18,
   "occurrence": 2
  },
  {
   "w": "different",
   "t0": 8.38,
   "t1": 8.58
  },
  {
   "w": "compound",
   "t0": 8.9,
   "t1": 9.62
  },
  {
   "w": "Only",
   "t0": 9.82,
   "t1": 10.02
  },
  {
   "w": "coefficients",
   "t0": 10.22,
   "t1": 10.82
  },
  {
   "w": "may",
   "t0": 10.9,
   "t1": 10.98
  },
  {
   "w": "change",
   "t0": 11.06,
   "t1": 11.78,
   "occurrence": 2
  }
 ],
 "beats": [
  0.02
 ],
 "cues": [
  {
   "id": "c13",
   "at": 2.17,
   "kind": "reveal",
   "element_id": "wrong_row",
   "word_index": 7
  },
  {
   "id": "c14",
   "at": 6.93,
   "kind": "reveal",
   "element_id": "wrong_tally",
   "word_index": 16
  },
  {
   "id": "c15",
   "at": 8.33,
   "kind": "reveal",
   "element_id": "wrong_note",
   "word_index": 21
  },
  {
   "id": "c16",
   "at": 9.77,
   "kind": "reveal",
   "element_id": "right_row",
   "word_index": 23
  },
  {
   "id": "c17",
   "at": 10.17,
   "kind": "emphasis",
   "element_id": "hl_coef",
   "word_index": 24
  }
 ],
 "sfx": [],
 "meta": {
  "video_id": "chem-balance-ci-01",
  "scene": "s04",
  "beat_ids": [
   "b05"
  ],
  "beats_text": [
   {
    "id": "b05",
    "slot": "misconception.confront",
    "text": "A tempting fix is to change a subscript, so water becomes hydrogen peroxide. The counts can match, but that is a different compound. Only coefficients may change.",
    "headline": "Change a subscript",
    "start": 0.157,
    "end": 11.78,
    "word_range": [
     0,
     27
    ]
   }
  ],
  "think_windows": []
 }
}