{
 "schema_version": "1.0",
 "scene_id": "chem-balance-ci-01-s01",
 "fps": 30,
 "duration": 11.9,
 "language": "en-IN",
 "alignment_source": "tts_provider",
 "narration_audio_sha256": "0cafc6b9ba41366a8dfece5586b143e0977d7d86ec7d9d82dc73997d043d7c17",
 "script_sha256": "ea9184430445e015c20a75b78ce2023f89a08ec192d884746da5cc4b9516ebed",
 "words": [
  {
   "w": "Hydrogen",
   "t0": 0.76,
   "t1": 1.32
  },
  {
   "w": "burns",
   "t0": 1.4,
   "t1": 1.68
  },
  {
   "w": "in",
   "t0": 1.72,
   "t1": 1.88
  },
  {
   "w": "oxygen",
   "t0": 1.96,
   "t1": 2.44
  },
  {
   "w": "to",
   "t0": 2.48,
   "t1": 2.52
  },
  {
   "w": "make",
   "t0": 2.6,
   "t1": 2.76
  },
  {
   "w": "water",
   "t0": 2.84,
   "t1": 3.48
  },
  {
   "w": "Write",
   "t0": 3.72,
   "t1": 3.88
  },
  {
   "w": "it",
   "t0": 3.92,
   "t1": 3.96
  },
  {
   "w": "down",
   "t0": 4.04,
   "t1": 4.76
  },
  {
   "w": "H",
   "t0": 4.92,
   "t1": 5.08,
   "occurrence": 1
  },
  {
   "w": "two",
   "t0": 5.16,
   "t1": 5.4,
   "occurrence": 1
  },
  {
   "w": "plus",
   "t0": 5.56,
   "t1": 5.72
  },
  {
   "w": "O",
   "t0": 5.88,
   "t1": 6.04,
   "occurrence": 1
  },
  {
   "w": "two",
   "t0": 6.12,
   "t1": 6.28,
   "occurrence": 2
  },
  {
   "w": "gives",
   "t0": 6.52,
   "t1": 6.76
  },
  {
   "w": "H",
   "t0": 6.84,
   "t1": 7.08,
   "occurrence": 2
  },
  {
   "w": "two",
   "t0": 7.16,
   "t1": 7.24,
   "occurrence": 3
  },
  {
   "w": "O",
   "t0": 7.4,
   "t1": 7.72,
   "occurrence": 2
  },
  {
   "w": "Count",
   "t0": 8.2,
   "t1": 8.36
  },
  {
   "w": "the",
   "t0": 8.44,
   "t1": 8.52
  },
  {
   "w": "atoms",
   "t0": 8.8,
   "t1": 9.32
  },
  {
   "w": "Did",
   "t0": 9.56,
   "t1": 9.64
  },
  {
   "w": "an",
   "t0": 9.72,
   "t1": 9.8
  },
  {
   "w": "atom",
   "t0": 9.88,
   "t1": 10.2
  },
  {
   "w": "just",
   "t0": 10.28,
   "t1": 10.44
  },
  {
   "w": "vanish",
   "t0": 10.6,
   "t1": 11.4
  }
 ],
 "beats": [
  0.6
 ],
 "cues": [
  {
   "id": "c01",
   "at": 0.71,
   "kind": "reveal",
   "element_id": "mol_H2",
   "word_index": 0
  },
  {
   "id": "c02",
   "at": 1.91,
   "kind": "reveal",
   "element_id": "mol_O2",
   "word_index": 3
  },
  {
   "id": "c03",
   "at": 2.79,
   "kind": "reveal",
   "element_id": "mol_H2O",
   "word_index": 6
  },
  {
   "id": "c04",
   "at": 4.87,
   "kind": "reveal",
   "element_id": "f_H2",
   "word_index": 10
  },
  {
   "id": "c05",
   "at": 5.51,
   "kind": "reveal",
   "element_id": "op_plus",
   "word_index": 12
  },
  {
   "id": "c06",
   "at": 5.83,
   "kind": "reveal",
   "element_id": "f_O2",
   "word_index": 13
  },
  {
   "id": "c07",
   "at": 6.47,
   "kind": "reveal",
   "element_id": "op_arrow",
   "word_index": 15
  },
  {
   "id": "c08",
   "at": 6.79,
   "kind": "reveal",
   "element_id": "f_H2O",
   "word_index": 16
  },
  {
   "id": "c09",
   "at": 8.15,
   "kind": "emphasis",
   "element_id": "mols",
   "word_index": 19
  },
  {
   "id": "c10",
   "at": 10.55,
   "kind": "emphasis",
   "element_id": "eq",
   "word_index": 26
  }
 ],
 "sfx": [],
 "meta": {
  "video_id": "chem-balance-ci-01",
  "scene": "s01",
  "beat_ids": [
   "b01"
  ],
  "beats_text": [
   {
    "id": "b01",
    "slot": "hook.question_reveal",
    "text": "Hydrogen burns in oxygen to make water. Write it down: H two plus O two gives H two O. Count the atoms. Did an atom just vanish?",
    "headline": "did an atom vanish",
    "start": 0.76,
    "end": 11.4,
    "word_range": [
     0,
     27
    ]
   }
  ],
  "think_windows": []
 }
}